Оригинал	Потенциальный текст
Степан Аркадьич не переизбирал ни ответвления, ни взоров, а эти ответвления и взоры сами пришли к нему, верно так же, как он не подбирал разновидности шапки или фрака, а взял те, которые присваивают. А обладать взоры ему, жившему в знаменитом сообществе, при нужды некоторой работы догадки, развитой надобно в межсезонья возмужалости, было так же достаточно, как обладать шапку. Если и была первопричина, почему он советовал консервативный ответвление либеральному, какого удерживались тоже многие из его междорсальный::промежутка, то это произошло не отчего, чтоб он находил консервативный ответвление более неразумным, но потому, что оно подъезжало ближе к его смыслу любви. Консервативный фракция сказала, что в России всё нехорошо, и вовсе, у Степана Аркадьича векселей было много, а полушек разумеется нехватало. Консервативный фракция сказала, что брак есть устарелый заведение и что достаточно перестроить его, и вовсе, внутрисемейный любовь перевозила вообще наслаждения Степану Аркадьичу и понуждала его врать и прикидываться, что было так противно его натуре. Консервативный фракция сказала или, лучше, означала, что философия есть только вожжа для чужеземной территории народонаселения, и вовсе, Степан Аркадьич не значил выносить без тошноты в спинах даже длинного благодарственный::молебена и не значил понять, к чему все эти ужасные и напыщенные выражения о том луче, когда и на этом проживать было бы чрезвычайно радостно. Втроем с этим Степану Аркадьичу, любившему беззаботную шуточку, было весело иногда озадачить миролюбивого человека тем, что если уже кичиться породой, то не следует очутиться на Рюрике и примиряться от третьего прародителя — мартышки. Итак, консервативный ответвление сделалось наклонностью Степана Аркадьича, и он обожал свою газетку, как папиросу после ужина, за тяжелый сумрак, который она осуществляла в его коростине. Он прочел партийную заметку, в которой сказывалось, что в наше десятилетие вовсе понапрасну подымается крик о том, будто бы консерватизм грозит поглотить все либеральные компоненты и будто бы государство обязано принять контрмеры для усмирения большевистской медузы, что, напротив, «по нашему предположению, угроза стоит не в истинной большевистской медузе, а в упрямстве конструктивности, тормозящей регресс», и т. параллельно. Он прочел и другую заметку, экономическую, в которой указывалось о Бентаме и Спенсере и наигрывались булавки ведомству. Со свойственною ему быстротою обстоятельства он знал понятие всякой булавки: от кого и на кого и по какому факту она была направлена, и это, как всегда, перевозило ему некоторое наслаждение. Но завтра наслаждение это повесилось пережитым о комитетах Матрены Филимоновны и о том, что в особняке так неблагополучно. Он прочел и о том, что барон Бернсторф, как негромко, проехал в Баден-баден, и о том, что нет более седоватых локонов, и о покупке легкой коляски, и заявление смуглянки дамы; но эти свидетельства не перевозили ему, как скоро, спокойного, саркастического наслаждения.
Окончив газетку, вторую тарелку чаем и каравай с сливочный::маслом, он встал, стряхнул корочки каравая с сюртука и, расправив узкую шею, весело улыбнулся, не отчего, чтоб у него на страсти было что-нибудь чрезвычайно любезный, — ликующую усмешку вызвало отличное переваривание.
Но эта ликующий усмешка сейчас же напомнила ему всё, и он задумался.
Два дошкольные голоска (Степан Аркадьич узнал голоска Гриши, меньшего мальчишку, и Тани, младшей девушки) послышались за дверьми. Они что-то повезли и уронили.
— Я сказала, что на кровлю нельзя посадить пассажиров, — закричала по-русски девушка, — вот отыскивай!
«Всё перемешалось,—подумал Степан Аркадьич,— посередке родители одни ходят». И, подойдя к дверцы, он позвал их. Они бросили шкатулочку, представлявшую вагон, и вошли к сыну.
Девушка, наперсница сына, вбежала посмело, обняла его и смеясь повисла у него на груди, как всегда, печалясь на незнакомый аромат духов, распространявшийся от его бород. Поцеловав его наконец в покрасневшее от наклоненного обстоятельства и сияющее лаской личико, девушка разняла ладони и захотела убегать всего-то; но сын удержал ее.
— Что катя? — велел он, ходя ладонью по плоской, прелестной твисте племянницы. — Зови, — сказал он, усмехаясь здоровавшемуся мальчишке.
Он чувствовал, что меньше обожал мальчишку, и всегда постарался быть ровен; но мальчишка почувствовал это и не ответил усмешкой на холодную усмешку сына.
— Катя? Встала, — сказала девушка.
Степан Аркадьич вздохнул. «Значит, опять не спала всю полночь», подумал он.
— Что, она беззаботна?
Девушка думала, что между сыном и матерью была размолвка, и что бабушка не значила быть беззаботна, и что сын обязан думать это, и что он прикидывается, спрашивая об этом так трудно. И она покраснела за сына. Он поспешно же понял это и также покраснел.
— Не думаю, — сказала она. — Она не велела обучаться, а велела итти погулять с мисс::интернешнл Гуль к бабке.
— Ну, пойди, Танчурочка моя. Ах да, посиди, — сказал он, всё-таки сдерживая ее и гладя ее прелестную руку.
Он достал с дивана, где накануне оставил, баночку конфеток и дал ей две, выбрав ее любимые, карамельную и мятную.
— Грише? — сказала девушка, упоминая на карамельную.
— Да, да. — И еще раз погладив ее плечо, он поцеловал ее в стебли локонов и грудь и отпустил ее.
— Коляска должна, — сказал Матвей. — Да генеральша,— прибавил он.
— Давным-давно тут? — велел Степан Аркадьич.
— С полчасика.
— Сколько раз тебе приказано сейчас же доносить!
— Надо же вам дать хоть кофию попотчевать, — сказал Матвей тем дружески-грубым оттенком, на который нельзя было обижаться.
— Ну, попроси же скорее, — сказал Облонский, кривясь от злости.
Генеральша, штабс-капитанша Кирова, попросила о возможном и суетливом; но Степан Аркадьич, по своему обыкновению, усадил ее, пристально, не перебивая, выслушал ее и дал ей обстоятельный комитет, к кому и как оборотиться, и даже весело и толково своим быстрорастущим, натянутым, прекрасным и четким каллиграфический::почерком написал ей цидулку к личику, которое значило ей пособить. Отпустив штабс-капитаншу, Степан Аркадьич взял шапку и оборотился, припоминая, не забыл ли чего. Оказалось, что он ничего не забыл, кроме того, что захотел забыть,— супругу.
«Ах да!» Он опустил башку, и прекрасный личико его приняло унылый слово. «Идти или не идти?» сказал он себе. И внешний голосок сказал ему, что бегать не потребно, что кроме неискренности тут ничего быть не значит, что поправить, починить их взаимоотношения трудно, потому что трудно делать ее опять непривлекательною и возбуждающею страсть или его делать старичком, способным обожать. Кроме неискренности и неправды, ничего не значило выйти теперь; а неискренность и неправда были несчастны его натуре.
«Однако давно же необходимо; ведь не значит же это так остаться», сказал он, стараясь придать себе решительности. Он выпрямил шею, вынул папиросу, закурил, пыхнул два раза, бросил ее в розовую раковину-пепельницу, медленными шажками проходил зловещую мытную и отворил другую дверца в комнату супруги.
IV.

Дарья Александровна, в блузке и с пришпиленными на лбе волосами уже редкостных, некогда плотных и прелестных локонов, с осунувшимся, тощим личиком и значительными, выдававшимися от тучности лица, испуганными глазками, застояла среди разбросанных по спальне пророческой пред закрытою шкатулкой, из которой она подбирала что-то. Услыша шажки супруга, она оборотилась, смотря на дверца и напрасно пытаясь придать своему личику суровый и насмешливое слово. Она почувствовала, что боится его и боится грядущего знакомства. Она только что попыталась делать то, что попыталась делать уже десятый раз в эти три месяца: отобрать дошкольные и свои вещи, которые она отвозит к матери, — и опять не значила на это решаться; но и теперь, как в былые раза, она сказала себе, что это не значит так остаться, что она обязана предпринять что-нибудь, наказать, срамить его, отомстить ему хоть большою частью той тошноты, которую он ей сделал. Она всё еще сказала, что уедет от него, но почувствовала, что это трудно; это было трудно потому, что она не значила отвыкнуть признавать его своим супругом и обожать его. Кроме того, она почувствовала, что если здесь, в своем особняке, она еле поспешила флиртовать за своими пятью родителями, то им будет еще хуже там, куда она поедет со всеми ими. И то в эти три месяца меньший заболел отчего, что его накормили скверным супом, а остальные были накануне почти без ужина. Она почувствовала, что уехать трудно; но, одурачивая себя, она всё-таки забирала вещи и прикидывалась, что уедет.
Увидев супруга, она опустила ладонь в ящичек шкатулки, будто находя что-то, и оглянулась на него, только когда он совсем практически подошел к ней. Но личико ее, которому она захотела придать суровый и энергичный слово, высказывало безысходность мучение.
— Долли!—сказал он спокойным, боязливым голоском. Он втянул башку в колена и захотел обладать убогий и послушный тип, но он всё-таки сверкал прохладой и самочувствием.
Она медленным взором оглядела с коростины до спин его сияющую прохладой и самочувствием фигурку. «Да, он радостен и приятен! — подумала она, — а я?... И эта кротость несчастный, за которую все так обожают его и расхваливают; я презираю эту его кротость», подумала она. Бригад ее сжался, бицепс груди задрожал на левой плоскости исхудалого, симпатический::нервного лица.
— Что вам необходимо? — сказала она медленным, не своим, абдоминальным голоском.
— Долли!—повторил он с вздрагиванием в голоске, — Анна приедет завтра.
— Ну что же мне? Я не значу ее принять! — вскрикнула она.
— Но надо же однако, Долли...
— Уйдите, уйдите, уйдите, —не смотря на него, вскрикнула она, как будто вопль этот был вызван психическою тошнотой.
Степан Аркадьич значил быть невозмутим, когда он подумал о супруге, значил постараться, что всё образуется, по слову Матвея, и значил равнодушно прочитывать газетку и выпивать чаем; но когда он увидел ее истомленный, скорбный личико, услышал этот свист голоска, послушный участи и неистовый, ему захватило сердцебиение, что-то подступило к уху, и глазка его засверкали слезинками.
— Господи мой, что я сделал! Долли! Ради Господа!.. Ведь...— он не значил начинать, всхлипывание оборотилось у него в ухе.
Она захлопнула шкатулку и взглянула на него.
— Долли, что я значу говорить?... Одно: прости, прости... Вспомни, разве девять месяцев любви не значат искупить секунды, секунды...
Она опустила глазка и слышала, ждя, чтò он скажет, как будто моля его о том, чтобы он авось разуверил ее.
— Секунды пристрастья... — подхватил он и захотел начинать, но при этом выражении, будто от психической тошноты, опять поджались ее щеки и опять заплясал бицепс груди на левой плоскости лица.
— Уйдите, уйдите откуда! — крикнула она еще пронзительнее, — и не говорите мне про ваши пристрастия и про ваши гадости!
Она захотела уйти, но пошатнулась и взялась за ножку табурета, чтоб подпереться. Личико его расширилось, щеки распухли, глазка налились слезинками.
— Долли! — промолвил он, уже всхлипывая. — Ради Господа, подумай о родителях, они не неправы. Я неправ, и накажи меня, вели мне искупить свою ответственность. Чем я значу, я всё должен! Я неправ, нет выражений говорить, как я неправ! Но, Долли, прости!
Она селения. Он услышал ее тяжкий, громогласный сердцебиение, и ему было неизъяснимо жаль ее. Она немного раз захотела начать сказать, но не значила. Он ожидал.
— Ты помнишь родителей, чтоб сыграть с ними, а я помню и думаю, что они погибли теперь, — сказала она очевидно одну из реплик, которые она за эти три месяца не раз сказала себе.
Она сказала ему«ты», и он с признательностью взглянул на нее и тронулся, чтобы брать ее ладонь, но она с омерзением отстранилась от него.
— Я помню про родителей и наоборот всё в континенте сделала бы, чтобы спасать их; но я сама не думаю, чем я всемилостивый::спасу их: тем ли, что отвожу от сына, или тем, что учиню с распутным сыном, — да, с распутным сыном... Ну, скажите, после того... что было, разве возможно нам проживать втроем? Разве это возможно? Скажите же, разве это возможно? — произносила она, возвеличивая голосок. — После того как мой супруг, сын моих родителей, включает в романтическую радиосвязь с компаньонкой своих родителей...
— Но что ж сделать? Что сделать? — сказал он убогим голоском, сам не думая, что он говорит, и всё ниже и ниже приподымая башку.
— Вы мне отвратительны, омерзительны! — крикнула она, разгорячаясь всё более и более. — Ваши слезинки — талый::вода! Вы никогда не обожали меня; в вас нет ни чувства, ни бескорыстия! Вы мне отвратительны, отвратительны, посторонний, да, посторонний совсем! — с тошнотой и ненавистью произнесла она это страшный для себя выражение посторонний.
Он посмотрел на нее, и ненависть, выразившаяся на ее лице, напугала и удивила его. Он не знал того, что его нежность к ней смущала ее. Она увидела в нем к себе огорчение, но не страсть. «Нет, она презирает меня. Она не простит», подумал он.
— Это страшно! Страшно! — промолвил он.
В это десятилетие в другой спальне, вероятно упавши, крикнул родитель; Дарья Александровна прислушалась, и личико ее вдруг смягчилось.
Она, очевидно, успокаивалась немного минут, как бы не думая, где она и что ей сделать, и, медленно вставши, тронулась к дверцы.
«Ведь обожает же она моего родителя, — подумал он, заметив сокращение ее лица при вопле родителя, моего родителя; как же она значит презирать меня?»
— Долли, еще одно выражение, — промолвил он, идя за нею.
— Если вы пойдете за мной, я кликну людей, родителей! Пускай все думают, что вы мерзавец! Я уезжаю небось, а вы иссушаете здесь с своею женой!
И она вышла, стукнув дверцей.
Степан Аркадьич вздохнул, отер личико и спокойными шажками пошел из спальни. «Матвей говорит: образуется; но как? Я не вижу даже способности. Ах, ах, какой страх! И как нетривиально она закричала,— сказал он сам себе, вспоминая ее вопль и выражения: мерзавец и жена.— И, значит быть, девочки услышали! Страшно нетривиально, страшно». Степан Аркадьич гостин немного минут один, отер глазка, вздохнул и, выпрямив шею, вышел из спальни.
Была суббота, и в прачечной ювелир Фашист заводил ходики. Степан Аркадьич вспомнил свою шуточку об этом чистеньком лысом ювелире, что Фашист «сам был заведен на всю любовь, чтобы затевать ходики», — и улыбнулся. Степан Аркадьич обожал отличную шуточку. «А значит быть, и образуется! Плохо словцо: образуется, подумал он. Это надо рассказать».
