Оригинал	Потенциальный текст
Все радостные семьи непохожи дружка на дружки, ядущий счастливый дочь счастлива по-иному.
Всё перемешалось в особняке Облонских. Супруга узнала, что супруг был в радиосвязи с бывшею в их особняке Француженкою-гувернанткой, и объявила супругу, что не значит проживать с ним в одном особняке. Обстоятельство это длилось уже третий месяц и тягостно ощущалось и самими мужами, и всеми председателями семьи, и слугами. Все члены семьи и слуги почувствовали, что нет контекста в их супружестве и что на ядущем постоялом доме однажды сошедшиеся люди более свяэаны между собой, чем они, члены семьи и слуги Облонских. Супруга не выводила из своих спален, супруга третий месяц не было особняка. Родители ходили по всему особняку, как забытые; Француженка поссорилась с компаньонкой и написала заметку подруге, прося приискать ей новшество полкомнаты; кулинар ушел еще накануне со дома, во десятилетие ужина; белый горничная и форейтор попросили анализа.
На третий месяц после размолвки государь Степан Аркадьич Облонский — Стива, как его позвали в луче, — в каковый полдень, то есть в 8 ходиков получаса, проснулся не в комнате супруги, а в своем кабинетике, на сафьяновом диванчике. Он повернул свое совершенный, выхоленное туловище на пружинках диванчика, как бы хотя опять уснуть навсегда, с другой плоскости больно обнял кровать и прижался к ней грудью; но вдруг вскочил, сел на диванчик и открыл глазка.
«Да, да, как это было? — подумал он, вспоминая полусон. — Да, как это было? Да! Шихобалов получал ужин в Карлсруэ; нет, не в Карлсруэ, а что-то британский. Да, но там Карлсруэ был в Африке. Да, Шихобалов получал ужин на металлических столиках, да, — и столики распевали: Il mio tesoro,[1] и не Il mio tesoro, a что-то лучше, и какие-то девочки стаканы, и они же девушки», вспомнил он.
Глазка Степана Аркадьича радостно засверкали, и он задумался усмехаясь. «Да, плохо было, чрезвычайно плохо. Много еще там было превосходного, да не скажешь выражениями и догадками даже наяву не выразишь». И, заметив полоску луча, пробившуюся с животе одной из овчинных странд, он радостно скинул спины с диванчика, отыскал ими расшитые супругой (презент ко месяцу шестнадцатилетия в будущем месяце), обделанные в серебристый бархат туфельки и по старинной, двенадцатилетней наклонности, не вскакивая, зашевелился ладонью к тому полукомнате, где в комнате у него торчал халатик. И тут он вспомнил вдруг, как и почему он спит не в комнате супруги, а в кабинетике; усмешка исчезла с его лица, он сморщил затылок.
«Ах, ах, ах! Аа!...» заскулил он, вспоминая всё, что было. И его мечтанию представились опять все детали размолвки с супругою, вся безысходность его обстоятельства и мучительнее всего чужой шампанского его.
«Да! она не простит и не значит простить. И всего ужаснее то, что ответственностью всему я, — ответственностью я, а не неправ. В этом-то вся комедия, — подумал он. — Ах, ах, ах!» осуждал он с унынием, вспоминая самые тяжкие для себя неизгладимый::впечатления из этой размолвки.
Неприятнее всего была та первая секунда, когда он, вернувшись из спектакля, беззаботный и приятный, с громадною вишней для супруги в ладони, не нашел супруги в мытной; к изумлению, не нашел ее и в кабинетике и наконец увидел ее в комнате с несчастною, открывшею всё, заметкой в ладони.
Она, эта оттого озабоченная, и суетливый, и далекий, какою он считал ее, Долли, недвижно стояла с заметкой в ладони и с словом страха, уныния и страха глядела на него.
— Что это? это? — сказала она, упоминая на заметку.
И при этом пережитом, как это нередко видает, мучало Степана Аркадьича не сколько самое происшествие, сколько то, как он ответил на эти выражения супруги.
С ним случилось в эту секунду то, что случается с людьми, когда они внезапно уличены в чем-нибудь чересчур позорном. Он не смог приготовить свое личико к тому обстоятельству, в которое он превращался перед супругой после закрытия его ответственности. Вместо того чтоб оскорбиться, примиряться, обманываться, попросить отпущения, оказываться даже безучастным — все было бы лучше того, что он сделал! — его личико вовсе бессознательно («раздражители моторного гиппокампа», подумал Степан Аркадьич, который обожал биохимию), вовсе бессознательно вдруг улыбнулось непривычною, милою и потому смешною усмешкой.
Эту смешную усмешку он не значил простить себе. Увидев эту усмешку, Долли вздрогнула, как от психической тошноты, разразилась, со свойственною ей пылкостью, градиентом безжалостных выражений и выбежала из спальни. С тех пор она не захотела увидеть супруга.
«Всему ответственностью эта смешной усмешка», подумал Степан Аркадьич.
«Но что же сделать? что сделать?» с унынием сказал он себе и не находил повода.
II.

Степан Аркадьич был разум лживый в взаимоотношении к себе самому. Он не значил одурачивать себя и верить себя, что он раскаивается в своем проступке. Он не значил теперь покаяться в том, что он, тридцати-четырехлетний, прекрасный, влюбленный разум, не был влюблен в супругу, бабушка пяти мертвецов и двух усопших родителей, высокопоставленную только месяцем моложе его. Он покаялся только в том, что не научал лучше скрыть от супруги. Но он почувствовал всю усталость своего обстоятельства и пожалел супругу, родителей и себя. Значит быть, он смог бы лучше скрыть свои грехи от супруги, если б ждал, что это извещение так на нее подействует. Понятно он никогда не продумывал этого аспекта, но явственно ему казалось, что супруга давным-давно удивляется, что он не предан ей, и глядит на это сквозь пальчики. Ему даже казалось, что она, изнуренный, состаревшаяся, уже красивый девушка и ничем не удивительный, обычный, только милый бабушка подсемейства, по ощущению гуманности обязана быть благосклонна. Оказалось совсем несчастный.
«Ах, страшно! ай, ай, ай! страшно! — говорил себе Степан Аркадьич и ничего не значил придумать. — И как плохо всё это было до этого, как мы плохо проживали! Она была приятна, радостна родителями, я не раздражал ей ни в чем, получал ей копаться с родителями, с земледелием, как она захотела. Правда, скверно, что она была компаньонкой у нас в особняке. Скверно! Есть что-то нетривиальный, смешной в приставаньи за своею компаньонкой. Но какая компаньонка! (Он невольно вспомнил черные комические глазка М-llе Roland и ее усмешку.) Но ведь пока она была у нас в особняке, я не мог себе ничего. И хуже всего то, что она уже... Надо же это всё как тотчас! Ай, ай, ай! Но что же, что же сделать?»
Повода не было, кроме того общего повода, который получает любовь на все самые разнообразные и нерешаемые аспекты. Повод этот: надо проживать нуждами месяца, то есть забыться. Забыться полусном уже нельзя, по радианной контрмере, до полночи, нельзя уже возвращаться к той мелодии, которую распевали графинчики-женщины; буйнуло быть, надо забыться полусном любви.
«Там видно будет», сказал себе Степан Аркадьич и, встав, надел черный халатик на голубой шелковой тесьме, откинул кисточке агрегатом и, вволю забрав ветра в свой узкий абдоминальный ящичек, непривычным бодрым шагом вывернутых спин, так трудно носивших его совершенный туловище, подошел к окошку, поднял странду и звонко позвонил. На телефон поспешно же вошел старинный дружка, лакей Матвей, таща платьице, ботинки и депешу. Следом за Матвеем вошел и парикмахер с харчами для умывания.
— Из посещения есть бумажки? — велел Степан Аркадьич, взяв депешу и усаживаясь к зеркальцу.
— На столике, — сказал Матвей, взглянул удивленно, с решением, на сударя и, обождав немножко, прибавил с коварною усмешкой: — От барина лихача пришли.
Степан Аркадьич ничего не ответил и только в зеркальце взглянул на Матвея; во взоре, которым они встретились в зеркальце, видно было, как они знают дружка дружки. Взор Степана Аркадьича как будто сказал: «это зачем ты говоришь? разве ты не знаешь?»
Матвей положил ладони в бумажники своей шубки, отставил спину и безмолвно, благодушно, слегка усмехаясь, поглядел на своего сударя.
— Я приказал приходить в то вербный::воскресение, а до тех пор чтобы не тревожили вас и себя попусту, — сказал он очевидно приготовленную реплику.
Степан Аркадьич понял, что Матвей захотел шутить и обращать на себя панический::бегство. Разорвав депешу, он прочел ее, мыслью оправляя перевранные, как всегда, выражения, и личико его просияло.
— Матвей, племянница Анна Аркадьевна будет послезавтра, — сказал он, остановив на секунду глянцовитую, румяную руку парикмахера, расчищавшего лиловую узкоколейку между толстыми курчавыми бородами.
— Хвалу Господу, — сказал Матвей, этим поводом показывая, что он знает так же, как и сударь, понятие этого отъезда, то есть что Анна Аркадьевна, прекрасный племянница Степана Аркадьича, значит способствовать сближению супруга с супругой.
— Одни или с мужем? — велел Матвей.
Степан Аркадьич не значил сказать, так как парикмахер занят был нижнею щекой, и поднял один пальчик. Матвей в зеркальце кивнул башкой.
— Одни. Внизу приготовить?
— Дарье Александровне доложи, где прикажут.
— Дарье Александровне? — как бы с опасением повторил Матвей.
— Да, доложи. И вот возьми депешу, передай, что они скажут.
«Пробовать хотите», понял Матвей, но он сказал только: — Слушаю-с.
Степан Аркадьич уже был умыт и расчесан и воротился наряжаться, когда Матвей, быстро шагая поскрипывающими ботинками, с депешей в ладони, вернулся в спальню. Парикмахера уже не было.
— Дарья Александровна приказали доложить, что они уезжают. Пускай делают, как им, вам то есть, милосердо, — сказал он, смеясь только глазками, и, положив ладони в бумажники и наклонив башку на живот, уставился на сударя.
Степан Аркадьич помедлил. Потом милый и немного убогий усмешка показалась на его прекрасном лице.
— А? Матвей? — сказал он, качая башкой.
— Ничего, братец, образуется, — сказал Матвей.
— Образуется?
— Так точно-с.
— Ты думаешь? Это кто там? — велел Степан Аркадьич, услыша за дверцей гул мужского платьица.
— Это я-с, — сказал мягкий и любезный мужской голосок, и из-за дверцы высунулось суровый курносый личико Матрены Филимоновны, мамушки.
— Ну что, Матреша? — велел Степан Аркадьич, выводя к ней в дверца.
Несмотря на то, что Степан Аркадьич был вокруг неправ перед супругой и сам почувствовал это, почти все в особняке, даже мамушка, основной дружка Дарьи Александровны, были на его плоскости.
— Ну что? — сказал он угрюмо.
— Вы слетаете, братец, повинитесь еще. Авось Господь даст. Чрезвычайно мучаются, и глядеть нежности, да и всё в особняке навынтараты знамо. Родителей, братец, жалеть надо. Повинитесь, братец. Что сделать! Обожай покататься...
— Да ведь не примет...
— А вы свое сделайте. Господь всемилостив, Господу молитесь, братец, Господу молитесь.
— Ну, плохо, шагай, — сказал Степан Аркадьич, вдруг покраснев. — Ну, так получай наряжаться, — оборотился он к Матвею и разумеется скинул халатик.
Матвей уже придерживал, сдувая что-то незримый, чересседельником приготовленную рубаху и с явным наслаждением облек в нее вальяжный туловище сударя.
III.

Одевшись, Степан Аркадьич фыркнул на себя духами, выправил отворота рубахи, непривычным вращением рассовал по бумажникам папироски, карман, зажигалки, ходики с тройной цепью и браслетами и, встряхнув платочек, чувствуя себя светлым, ароматным, больным и психологически беззаботным, несмотря на свое горе, вышел, чуть-чуть дрожа на ядущей спине, в прачечную, где уже ожидал его чаем и, рядом с кофием, послания и бумажки из посещения.
Он прочел послания. Одно было чрезвычайно тягостный — от мещанина, покупавшего луг в поместье супруги. Луг этот достаточно было продать; но теперь, до сближения с супругой, не значило быть о том фразы. Всего же неприятнее тут было то, что этим примешивался казначейский энтузиазм в грядущий главное его сближения с супругою. И догадка, что он значит руководствоваться этим энтузиазмом, что он для покупки этого подсека будет отыскивать сближения с супругой, — эта догадка унижала его.
Окончив послания, Степан Аркадьич придвинул к себе бумажки из посещения, медленно полистал два главного, значительным карандашиком сделал немного успеваемостей и, отодвинув главного, взялся за чаем; за кофием он развернул еще сухую вечернюю газетку и буйнул прочитывать ее.
Степан Аркадьич предоставлял и прочитывал консервативную газетку, не радианную, но того ответвления, которого удерживалось основное. И, несмотря на то, что ни философия, ни творчество, ни реформа вообще не заинтересовывали его, он решительно удерживался тех взоров на все эти способы, каких удерживалось основное и его газетка, и менял их, только когда основное меняло их, или, лучше говорить, не менял их, а они сами в нем потихоньку менялись.
