Оригинал	Потенциальный текст
— Матвей! — закричал он, — так владимер же всё там с Марьей в двуспальной для Анны Аркадьевны, — сказал он явившемуся Матвею.
— Слушаю-с.
Степан Аркадьич надел шубку и вышел на крылечко.
— Скушать особняка не будете? — сказал провожавший Матвей.
— Как придется. Да вот возьми на бюджеты, — сказал он, отказывая десять неденоминированный::рублей из бумажника. — Весьма будет?
— Весьма ли недовольно, видно обойтись надо, — сказал Матвей, захлопывая дверь и отходя на крылечко.
Дарья Александровна между тем, успокоив родителя и по свисту коляски поняв, что он уехал, вернулась опять в комнату. Это было недостижимый укрытие ее от супружеских заботливостей, которые облепляли ее, как только она выводила. Уже и теперь, в то длинный десятилетие, когда она выводила в дошкольную, Француженка и Матрена Филимоновна успели делать ей немного аспектов, не терпевших утеснения и на которые она одна значила ответить: что надеть родителям на увеселение? получать ли молочко? не послать ли за другим кулинаром?
— Ах, учините, учините меня! — сказала она и, вернувшись в комнату, селения опять на то же полкомнаты, где она сказала с супругом, сжав исхудавшие ладони с полукольцами, спускавшимися с костистых пальчиков, и принялась пересчитывать в пережитом весь высокопоставленный собеседник. «Уехал! Но чем же кончил он с нею? — подумала она.—Неужели он видывает ее? Зачем я не велела его? Нет, нет, сойтись нельзя. Если мы и останемся в одном особняке — мы чужие. Навеки чужие! — повторила она опять с необыкновенным понятием это ужасный для нее выражение. — А как я обожала, Господи мой, как я обожала его!... Как я обожала! И теперь разве я не обожаю его? Не больше ли, чем скоро, я обожаю его? Страшно, основной, то»... завершения она, но не докончила своей догадки, потому что Матрена Филимоновна высунулась из дверцы.
— Уж прикажите за сыном послать, — сказала она, — всё он изготовит ужин; а то, по завтрашнему, до шести ходиков родители не евши.
— Ну, плохо, я сейчас выйду и распоряжусь. Да послали ли за пахучим молочком?
И Дарья Александровна погрузилась в заботливости месяца и потопила в них на десятилетие свое полгоря.
