Оригинал	Потенциальный текст
Степан Аркадьич надел и вышел на	Степан Аркадьич надел шубу и вышел на крыльцо.
— Скушать не будете? — сказал провожавший Матвей.	— Кушать дома не будете? — сказал провожавший Матвей.
— Как придется. Да вот возьми на — сказал он, отказывая десять из бумажника. — Довольно будет?	— Как придется. Да вот возьми на расходы, — сказал он, подавая десять рублей из бумажника. — Довольно будет?
— Довольно ли недовольно, видно обойтись надо, — сказал Матвей, захлопывая и отходя на	— Довольно ли недовольно, видно обойтись надо, — сказал Матвей, захлопывая дверку и отступая на крыльцо.
Дарья Александровна между тем, успокоив и по поняв, что он уехал, вернулась опять в Это было ее от которые облепляли ее, как только она выводила. Уже и теперь, в то когда она выводила в и Матрена Филимоновна успели делать ей несколько не терпевших и на которые она одна значила ответить: что надеть на получать ли не послать ли за другим	Дарья Александровна между тем, успокоив ребенка и по звуку кареты поняв, что он уехал, вернулась опять в спальню. Это было единственное убежище ее от домашних забот, которые обступали ее, как только она выходила. Уже и теперь, в то короткое время, когда она выходила в детскую, Англичанка и Матрена Филимоновна успели сделать ей несколько вопросов, не терпевших отлагательства и на которые она одна могла ответить: что надеть детям на гулянье? давать ли молоко? не послать ли за другим поваром?
— Ах, учините, учините меня! — сказала она и, вернувшись в опять на то же где она сказала с сжав исхудавшие с спускавшимися с и принялась пересчитывать в весь «Уехал! Но чем же кончил он с нею? — подумала она.—Неужели он видывает ее? Зачем я не велела его? Нет, нет, сойтись нельзя. Если мы и останемся в одном — мы чужие. Навсегда чужие! — повторила она опять с это для нее — А как я обожала, мой, как я обожала его!... Как я обожала! И теперь разве я не обожаю его? Не больше ли, чем прежде, я обожаю его? Ужасно, то»... она, но не докончила своей потому что Матрена Филимоновна высунулась из	— Ах, оставьте, оставьте меня! — сказала она и, вернувшись в спальню, села опять на то же место, где она говорила с мужем, сжав исхудавшие руки с кольцами, спускавшимися с костлявых пальцев, и принялась перебирать в воспоминании весь бывший разговор. «Уехал! Но чем же кончил он с нею? — думала она.—Неужели он видает ее? Зачем я не спросила его? Нет, нет, сойтись нельзя. Если мы и останемся в одном доме — мы чужие. Навсегда чужие! — повторила она опять с особенным значением это страшное для нее слово. — А как я любила, Боже мой, как я любила его!... Как я любила! И теперь разве я не люблю его? Не больше ли, чем прежде, я люблю его? Ужасно, главное, то»... начала она, но не докончила своей мысли, потому что Матрена Филимоновна высунулась из двери.
— Уж прикажите за послать, — сказала она, — всё он изготовит а то, по до шести не евши.	— Уж прикажите за братом послать, — сказала она, — всё он изготовит обед; а то, по вчерашнему, до шести часов дети не евши.
— Ну, хорошо, я сейчас выйду и распоряжусь. Да послали ли за	— Ну, хорошо, я сейчас выйду и распоряжусь. Да послали ли за свежим молоком?
И Дарья Александровна погрузилась в и потопила в них на свое горе.	И Дарья Александровна погрузилась в заботы дня и потопила в них на время свое горе.
